"count","description","id","price","title","image"
"4","Mephisto has yet another plan to obtain the Silver Surfer's soul. He disguises himself and walks among the humans. He now comes up with another plot.","7567ec4b-b10c-48c5-9345-fc73c48a80aa","2.4","The Silver Surfer","https://comicvine.gamespot.com/a/uploads/scale_large/11/117763/2403520-ss16.png"
"6","Diana seeks out Superman in order to ask that he deal with her in case she ever gets out of control with her powers.","7567ec4b-b10c-48c5-9345-fc73c48a80a0","10","Wonder Woman","https://comicvine.gamespot.com/a/uploads/scale_large/0/4/46616-3824-55259-1-wonder-woman.jpg"
"7","Englishman called Butcher meets Susan L. Rayner, the new director of CIA and tells her that he wants to be in charge of their anti-supe team, Rayner reluclantly agrees.","7567ec4b-b10c-48c5-9345-fc73c48a80a2","23","The Boys","https://comicvine.gamespot.com/a/uploads/scale_large/2/22773/584980-theboys01.jpg"
"12","Hellboy and Batman against nazis","7567ec4b-b10c-48c5-9345-fc73c48a80a1","15","Hellboy Batman crossover","https://comicvine.gamespot.com/a/uploads/scale_large/0/3125/3680604-hell3.jpg"
"7","One of the works that helped cement Frank Miller's reputation as one of the most innovative creators of the comic book industry! ","7567ec4b-b10c-48c5-9345-fc73c48a80a3","23","Hard Boiled","https://comicvine.gamespot.com/a/uploads/scale_large/5/58436/1127211-aaa_000.jpg"
"8","Robert Cadling visits a renaissance fare with his girlfriend. He has a conversation with Death who tells her about Morpheus.","7567ec4b-b10c-48c5-9345-fc73348a80a1","15","The Sandman","https://comicvine.gamespot.com/a/uploads/scale_large/0/4/37283-4207-41743-1-sandman-the.jpg"
"2","Jesse goes to Washington D.C. to talk to Spaceman about his father's Medal of Honor.","7567ec4b-b10c-48c5-9445-fc73c48a80a2","23","Preacher","https://comicvine.gamespot.com/a/uploads/scale_large/6/67663/2033012-50.jpg"
"3","Star Wars-style action collides with Game of Thrones-esque drama in this original sci-fi/fantasy epic for mature readers","7567ec4b-b10c-45c5-9345-fc73c48a80a1","15","Saga","https://comicvine.gamespot.com/a/uploads/scale_small/10/108980/2260155-saga__1__2012_.jpg"
